<?xml version="1.0" encoding="ISO-8859-1"?>

 <!DOCTYPE tiles-definitions PUBLIC
       "-//Apache Software Foundation//DTD Tiles Configuration//EN"
       "http://jakarta.apache.org/struts/dtds/tiles-config.dtd">


<!-- html definition Mappings  -->
<tiles-definitions>

  <!-- Main Layout Definition description  -->
  <definition name="mainLayout" >
	  <put name="title"  value="World Financial Online - Silver" />
	  <!-- <put name="header" value="/common/header.jsp" />  -->
	  <put name="footer" value="/silver/common/footer.jsp" />
	  <!-- <put name="menu"   value="menu.main" />  -->
	  <!-- <put name="body"   value="main.portal.body" />  -->
  </definition>
  
  <!-- select language menu -->
<definition name="menu.lang" path="/common/submenu.jsp" >
  <put name="title" value="Langue" />
  <putList name="items" >
    <add value="Gold" />
    <add value="Bronze" />
  </putList>
  <putList name="links" >
    <add value="/priviledge.do?priviledge=gold" />
    <add value="/priviledge.do?priviledge=bronze" />
  </putList>
</definition>

</tiles-definitions>
